{
  "run_id": "squeezenet1_1__adam__seed42",
  "model": "squeezenet1_1",
  "optimizer": "adam",
  "seed": 42,
  "device": "cuda:0 (Tesla T4)",
  "epochs": [
    {
      "epoch": 1,
      "train_loss": 0.49431999787767095,
      "val_loss": 0.2844871146172101,
      "train_acc": 0.8419576719576719,
      "val_acc": 0.9051851851851852,
      "lr": 0.0009972883382072953,
      "epoch_time_s": 7.890705454999988
    },
    {
      "epoch": 2,
      "train_loss": 0.28152813191136355,
      "val_loss": 0.24828779396267583,
      "train_acc": 0.9042857142857142,
      "val_acc": 0.9101234567901234,
      "lr": 0.0009891830623632338,
      "epoch_time_s": 8.112117896000086
    },
    {
      "epoch": 3,
      "train_loss": 0.25261677827784623,
      "val_loss": 0.23706020888722973,
      "train_acc": 0.9140211640211641,
      "val_acc": 0.9232098765432099,
      "lr": 0.0009757729755661011,
      "epoch_time_s": 8.074050303000035
    },
    {
      "epoch": 4,
      "train_loss": 0.22796511686037457,
      "val_loss": 0.23809531136680348,
      "train_acc": 0.9224867724867725,
      "val_acc": 0.9180246913580247,
      "lr": 0.0009572050015330874,
      "epoch_time_s": 8.101644471999975
    },
    {
      "epoch": 5,
      "train_loss": 0.2208210808764059,
      "val_loss": 0.20346354607216738,
      "train_acc": 0.9250793650793651,
      "val_acc": 0.9241975308641975,
      "lr": 0.0009336825748732973,
      "epoch_time_s": 8.097638711999934
    },
    {
      "epoch": 6,
      "train_loss": 0.21393608505448336,
      "val_loss": 0.2050072988173292,
      "train_acc": 0.9274603174603174,
      "val_acc": 0.922962962962963,
      "lr": 0.0009054634122155991,
      "epoch_time_s": 8.01996713699998
    },
    {
      "epoch": 7,
      "train_loss": 0.1991980916923947,
      "val_loss": 0.22181118068089822,
      "train_acc": 0.9331216931216931,
      "val_acc": 0.9241975308641975,
      "lr": 0.0008728566886113102,
      "epoch_time_s": 8.029546635999964
    },
    {
      "epoch": 8,
      "train_loss": 0.1881265753066098,
      "val_loss": 0.19993867979304475,
      "train_acc": 0.9342857142857143,
      "val_acc": 0.9296296296296296,
      "lr": 0.0008362196501476349,
      "epoch_time_s": 8.088757028000032
    },
    {
      "epoch": 9,
      "train_loss": 0.17669558076631456,
      "val_loss": 0.2157572235185423,
      "train_acc": 0.9384126984126984,
      "val_acc": 0.9291358024691359,
      "lr": 0.0007959536998847742,
      "epoch_time_s": 8.10584102100006
    },
    {
      "epoch": 10,
      "train_loss": 0.1768281848626162,
      "val_loss": 0.19280175877758016,
      "train_acc": 0.9381481481481482,
      "val_acc": 0.931358024691358,
      "lr": 0.0007525,
      "epoch_time_s": 8.160069152000005
    },
    {
      "epoch": 11,
      "train_loss": 0.16326586179947727,
      "val_loss": 0.19147936110097316,
      "train_acc": 0.9429100529100529,
      "val_acc": 0.9338271604938272,
      "lr": 0.0007063346383225212,
      "epoch_time_s": 8.130110691000027
    },
    {
      "epoch": 12,
      "train_loss": 0.17124768420186623,
      "val_loss": 0.190820433612407,
      "train_acc": 0.9414814814814815,
      "val_acc": 0.9328395061728395,
      "lr": 0.000657963412215599,
      "epoch_time_s": 8.068612365000035
    },
    {
      "epoch": 13,
      "train_loss": 0.15708191544290573,
      "val_loss": 0.17347683751277257,
      "train_acc": 0.9447089947089947,
      "val_acc": 0.9385185185185185,
      "lr": 0.0006079162869547909,
      "epoch_time_s": 8.14880515699997
    },
    {
      "epoch": 14,
      "train_loss": 0.15291388918010015,
      "val_loss": 0.1875183437819834,
      "train_acc": 0.948042328042328,
      "val_acc": 0.937037037037037,
      "lr": 0.0005567415893174886,
      "epoch_time_s": 8.068278268000086
    },
    {
      "epoch": 15,
      "train_loss": 0.1490160720464256,
      "val_loss": 0.1882115706835333,
      "train_acc": 0.9477777777777778,
      "val_acc": 0.9385185185185185,
      "lr": 0.0005050000000000002,
      "epoch_time_s": 8.042219240000009
    },
    {
      "epoch": 16,
      "train_loss": 0.14383109143210782,
      "val_loss": 0.19157290419851097,
      "train_acc": 0.9498412698412698,
      "val_acc": 0.931604938271605,
      "lr": 0.0004532584106825117,
      "epoch_time_s": 7.998597874999973
    },
    {
      "epoch": 17,
      "train_loss": 0.13954922944149642,
      "val_loss": 0.17504725215416173,
      "train_acc": 0.9513756613756614,
      "val_acc": 0.9375308641975308,
      "lr": 0.00040208371304520916,
      "epoch_time_s": 8.069675435000022
    },
    {
      "epoch": 18,
      "train_loss": 0.13602305729553182,
      "val_loss": 0.17826330887199737,
      "train_acc": 0.9538624338624339,
      "val_acc": 0.9367901234567901,
      "lr": 0.00035203658778440114,
      "epoch_time_s": 8.064795770000046
    },
    {
      "epoch": 19,
      "train_loss": 0.1291285797338637,
      "val_loss": 0.18194655444886948,
      "train_acc": 0.9548148148148148,
      "val_acc": 0.9395061728395062,
      "lr": 0.00030366536167747904,
      "epoch_time_s": 8.051940646999924
    },
    {
      "epoch": 20,
      "train_loss": 0.12952375293566437,
      "val_loss": 0.17182019415483982,
      "train_acc": 0.9549735449735449,
      "val_acc": 0.94,
      "lr": 0.00025750000000000013,
      "epoch_time_s": 8.013020660999928
    },
    {
      "epoch": 21,
      "train_loss": 0.12051624967938378,
      "val_loss": 0.1698905240100475,
      "train_acc": 0.957037037037037,
      "val_acc": 0.942716049382716,
      "lr": 0.00021404630011522585,
      "epoch_time_s": 8.040664525000011
    },
    {
      "epoch": 22,
      "train_loss": 0.11955229614935224,
      "val_loss": 0.1676221989944899,
      "train_acc": 0.956931216931217,
      "val_acc": 0.9441975308641976,
      "lr": 0.00017378034985236535,
      "epoch_time_s": 8.046621691000041
    },
    {
      "epoch": 23,
      "train_loss": 0.11829991785306779,
      "val_loss": 0.16719185401015788,
      "train_acc": 0.9571957671957672,
      "val_acc": 0.9419753086419753,
      "lr": 0.00013714331138868998,
      "epoch_time_s": 8.052664972999992
    },
    {
      "epoch": 24,
      "train_loss": 0.11379953770410448,
      "val_loss": 0.16396998210384706,
      "train_acc": 0.9607407407407408,
      "val_acc": 0.9414814814814815,
      "lr": 0.00010453658778440108,
      "epoch_time_s": 8.050801022999963
    },
    {
      "epoch": 25,
      "train_loss": 0.11044276418903518,
      "val_loss": 0.1638416502813314,
      "train_acc": 0.9597354497354498,
      "val_acc": 0.9434567901234568,
      "lr": 7.631742512670285e-05,
      "epoch_time_s": 8.11256957799992
    },
    {
      "epoch": 26,
      "train_loss": 0.10862802121847395,
      "val_loss": 0.16286513581871986,
      "train_acc": 0.9615873015873015,
      "val_acc": 0.9432098765432099,
      "lr": 5.279499846691252e-05,
      "epoch_time_s": 8.033643808999955
    },
    {
      "epoch": 27,
      "train_loss": 0.10628499349273701,
      "val_loss": 0.16496910098250264,
      "train_acc": 0.9625925925925926,
      "val_acc": 0.9444444444444444,
      "lr": 3.4227024433899005e-05,
      "epoch_time_s": 8.11371189700003
    },
    {
      "epoch": 28,
      "train_loss": 0.10581978376107241,
      "val_loss": 0.1636151997802526,
      "train_acc": 0.9636507936507936,
      "val_acc": 0.9424691358024692,
      "lr": 2.0816937636766188e-05,
      "epoch_time_s": 8.081469353999978
    },
    {
      "epoch": 29,
      "train_loss": 0.10065307476927364,
      "val_loss": 0.1642142467037487,
      "train_acc": 0.9642328042328042,
      "val_acc": 0.9441975308641976,
      "lr": 1.2711661792704668e-05,
      "epoch_time_s": 8.108043645999942
    },
    {
      "epoch": 30,
      "train_loss": 0.10331041045289821,
      "val_loss": 0.1630559850397899,
      "train_acc": 0.9630687830687831,
      "val_acc": 0.9439506172839506,
      "lr": 1e-05,
      "epoch_time_s": 8.11088139900005
    }
  ],
  "best_epoch": 27,
  "best_val_acc": 0.9444444444444444,
  "total_train_time_s": 242.08746581599996,
  "hyperparameters": {
    "optimizer": "adam",
    "lr": 0.001,
    "betas": [
      0.9,
      0.999
    ],
    "eps": 1e-08,
    "weight_decay": 0.0001,
    "amsgrad": false,
    "parameter_group_lrs": [
      0.0001,
      0.001
    ],
    "batch_size": 64,
    "scheduler": "cosine",
    "augmentation": {
      "train": [
        "random_horizontal_flip",
        "random_vertical_flip",
        "random_rotation_90"
      ],
      "val": [],
      "test": []
    }
  }
}
