{
  "run_id": "model_b__sgd_momentum__seed42",
  "model": "model_b",
  "optimizer": "sgd_momentum",
  "seed": 42,
  "device": "cuda:0 (Tesla T4)",
  "epochs": [
    {
      "epoch": 1,
      "train_loss": 0.9525028318829006,
      "val_loss": 0.6812124791529811,
      "train_acc": 0.66005291005291,
      "val_acc": 0.7525925925925926,
      "lr": 0.009972636867364526,
      "epoch_time_s": 11.158103264000033
    },
    {
      "epoch": 2,
      "train_loss": 0.5754440658180802,
      "val_loss": 0.457812407568649,
      "train_acc": 0.7951322751322751,
      "val_acc": 0.8360493827160493,
      "lr": 0.009890847265665359,
      "epoch_time_s": 11.26073200899998
    },
    {
      "epoch": 3,
      "train_loss": 0.46144101491050116,
      "val_loss": 0.4127100178194635,
      "train_acc": 0.8374074074074074,
      "val_acc": 0.860246913580247,
      "lr": 0.009755527298894293,
      "epoch_time_s": 11.252871876999961
    },
    {
      "epoch": 4,
      "train_loss": 0.37492271417032474,
      "val_loss": 0.30466571140344495,
      "train_acc": 0.8683597883597883,
      "val_acc": 0.8982716049382716,
      "lr": 0.00956815956092479,
      "epoch_time_s": 11.118809162000048
    },
    {
      "epoch": 5,
      "train_loss": 0.33264820860491856,
      "val_loss": 0.3150140933793636,
      "train_acc": 0.8846560846560847,
      "val_acc": 0.8918518518518519,
      "lr": 0.009330796891903272,
      "epoch_time_s": 10.941690408999989
    },
    {
      "epoch": 6,
      "train_loss": 0.28911088809765206,
      "val_loss": 0.24391542222396828,
      "train_acc": 0.9016931216931217,
      "val_acc": 0.9123456790123456,
      "lr": 0.009046039886902862,
      "epoch_time_s": 11.03253634500004
    },
    {
      "epoch": 7,
      "train_loss": 0.2620457688967387,
      "val_loss": 0.25105491706733535,
      "train_acc": 0.9104761904761904,
      "val_acc": 0.9113580246913581,
      "lr": 0.008717008403259584,
      "epoch_time_s": 10.918957414000033
    },
    {
      "epoch": 8,
      "train_loss": 0.2524854597149703,
      "val_loss": 0.2720476923570221,
      "train_acc": 0.9132275132275133,
      "val_acc": 0.9076543209876543,
      "lr": 0.008347307378762497,
      "epoch_time_s": 10.908232265000038
    },
    {
      "epoch": 9,
      "train_loss": 0.23741941056869648,
      "val_loss": 0.2076667055984338,
      "train_acc": 0.9178835978835979,
      "val_acc": 0.9293827160493827,
      "lr": 0.007940987335200904,
      "epoch_time_s": 11.049852513999895
    },
    {
      "epoch": 10,
      "train_loss": 0.21799817868641444,
      "val_loss": 0.18340588268973393,
      "train_acc": 0.9242328042328042,
      "val_acc": 0.937037037037037,
      "lr": 0.0075025000000000005,
      "epoch_time_s": 10.95124835699994
    },
    {
      "epoch": 11,
      "train_loss": 0.2003528243744815,
      "val_loss": 0.16987984580827165,
      "train_acc": 0.9308465608465608,
      "val_acc": 0.9437037037037037,
      "lr": 0.007036649532163624,
      "epoch_time_s": 10.97734780799999
    },
    {
      "epoch": 12,
      "train_loss": 0.19079470567917697,
      "val_loss": 0.20076912318988716,
      "train_acc": 0.9341269841269841,
      "val_acc": 0.9306172839506173,
      "lr": 0.006548539886902864,
      "epoch_time_s": 11.008895510999992
    },
    {
      "epoch": 13,
      "train_loss": 0.18304981760247044,
      "val_loss": 0.1951159519560773,
      "train_acc": 0.9376190476190476,
      "val_acc": 0.9335802469135802,
      "lr": 0.006043518895634708,
      "epoch_time_s": 10.865148047000048
    },
    {
      "epoch": 14,
      "train_loss": 0.17936628471606622,
      "val_loss": 0.17003318596220243,
      "train_acc": 0.9376719576719577,
      "val_acc": 0.9377777777777778,
      "lr": 0.005527119674021931,
      "epoch_time_s": 11.09152794900001
    },
    {
      "epoch": 15,
      "train_loss": 0.16557402323162745,
      "val_loss": 0.15362300872848725,
      "train_acc": 0.9435449735449736,
      "val_acc": 0.9471604938271605,
      "lr": 0.0050050000000000025,
      "epoch_time_s": 11.263531178999983
    },
    {
      "epoch": 16,
      "train_loss": 0.15782397613323554,
      "val_loss": 0.17004000639933864,
      "train_acc": 0.9458201058201058,
      "val_acc": 0.9409876543209876,
      "lr": 0.0044828803259780725,
      "epoch_time_s": 11.055986821000033
    },
    {
      "epoch": 17,
      "train_loss": 0.155310307542483,
      "val_loss": 0.15427591393086598,
      "train_acc": 0.9482539682539682,
      "val_acc": 0.9419753086419753,
      "lr": 0.0039664811043652924,
      "epoch_time_s": 11.08026798000003
    },
    {
      "epoch": 18,
      "train_loss": 0.15073755277527703,
      "val_loss": 0.13792224550884172,
      "train_acc": 0.9477248677248677,
      "val_acc": 0.9508641975308642,
      "lr": 0.0034614601130971393,
      "epoch_time_s": 10.999339954999982
    },
    {
      "epoch": 19,
      "train_loss": 0.13997877541673245,
      "val_loss": 0.12851901149952116,
      "train_acc": 0.9525396825396826,
      "val_acc": 0.9525925925925925,
      "lr": 0.00297335046783638,
      "epoch_time_s": 10.989137880000044
    },
    {
      "epoch": 20,
      "train_loss": 0.13616053683417184,
      "val_loss": 0.11952982291630987,
      "train_acc": 0.954021164021164,
      "val_acc": 0.9567901234567902,
      "lr": 0.002507500000000002,
      "epoch_time_s": 10.986150187000021
    },
    {
      "epoch": 21,
      "train_loss": 0.13741482081236664,
      "val_loss": 0.11865066938188479,
      "train_acc": 0.9521164021164021,
      "val_acc": 0.9560493827160493,
      "lr": 0.002069012664799098,
      "epoch_time_s": 11.001711871999987
    },
    {
      "epoch": 22,
      "train_loss": 0.132706245581309,
      "val_loss": 0.12764513946931672,
      "train_acc": 0.9537566137566138,
      "val_acc": 0.9533333333333334,
      "lr": 0.0016626926212375054,
      "epoch_time_s": 10.895256581000012
    },
    {
      "epoch": 23,
      "train_loss": 0.12562916054927484,
      "val_loss": 0.1142666541588964,
      "train_acc": 0.9566666666666667,
      "val_acc": 0.9595061728395061,
      "lr": 0.0012929915967404173,
      "epoch_time_s": 10.906009277000067
    },
    {
      "epoch": 24,
      "train_loss": 0.12200327022444635,
      "val_loss": 0.11592512040117318,
      "train_acc": 0.9567195767195767,
      "val_acc": 0.9558024691358025,
      "lr": 0.0009639601130971385,
      "epoch_time_s": 11.031108121999978
    },
    {
      "epoch": 25,
      "train_loss": 0.11960983331241305,
      "val_loss": 0.11007827156476309,
      "train_acc": 0.958994708994709,
      "val_acc": 0.9590123456790124,
      "lr": 0.000679203108096729,
      "epoch_time_s": 10.959103294999977
    },
    {
      "epoch": 26,
      "train_loss": 0.12064250934691656,
      "val_loss": 0.11030428372156795,
      "train_acc": 0.9582539682539682,
      "val_acc": 0.9590123456790124,
      "lr": 0.00044184043907520836,
      "epoch_time_s": 11.013437680000038
    },
    {
      "epoch": 27,
      "train_loss": 0.11870756881577628,
      "val_loss": 0.10762024614120615,
      "train_acc": 0.9597354497354498,
      "val_acc": 0.9602469135802469,
      "lr": 0.00025447270110570826,
      "epoch_time_s": 11.09213385299995
    },
    {
      "epoch": 28,
      "train_loss": 0.11578157069821837,
      "val_loss": 0.1070947411255681,
      "train_acc": 0.9597354497354498,
      "val_acc": 0.9604938271604938,
      "lr": 0.00011915273433464065,
      "epoch_time_s": 11.06675731300004
    },
    {
      "epoch": 29,
      "train_loss": 0.11500088335108505,
      "val_loss": 0.10704066140605942,
      "train_acc": 0.95994708994709,
      "val_acc": 0.9624691358024692,
      "lr": 3.7363132635474375e-05,
      "epoch_time_s": 11.244676480000066
    },
    {
      "epoch": 30,
      "train_loss": 0.11270426462724727,
      "val_loss": 0.1059062725165284,
      "train_acc": 0.9596296296296296,
      "val_acc": 0.9614814814814815,
      "lr": 1e-05,
      "epoch_time_s": 11.272792887000037
    }
  ],
  "best_epoch": 29,
  "best_val_acc": 0.9624691358024692,
  "total_train_time_s": 331.39335429300024,
  "hyperparameters": {
    "optimizer": "sgd_momentum",
    "lr": 0.01,
    "momentum": 0.9,
    "dampening": 0.0,
    "weight_decay": 0.0001,
    "nesterov": false,
    "batch_size": 64,
    "scheduler": "cosine",
    "augmentation": {
      "train": [
        "random_horizontal_flip",
        "random_vertical_flip",
        "random_rotation_90"
      ],
      "val": [],
      "test": []
    }
  }
}
